SQL> 
SQL> --1. Find the product_no and description of non- moving products.
SQL> select product_no, description from product_master;

PRODUCT_NO           DESCRIPTION                                                
-------------------- --------------------                                       
P00001               1.44floppies                                               
P03453               Monitors                                                   
P06734               Mouse                                                      
P07865               1.22floppies                                               
P07868               Keyboards                                                  
P07885               CD Drive                                                   
P07965               540 HDD                                                    
P07975               1.44 Drive                                                 
P08865               1.22 Drive                                                 

9 rows selected.

SQL> 
SQL> select product_no, description from product_master where product_no not in (select distinct product_no from sales_order_details);

PRODUCT_NO           DESCRIPTION                                                
-------------------- --------------------                                       
P07865               1.22floppies                                               
P07868               Keyboards                                                  
P08865               1.22 Drive                                                 

SQL> 
SQL> select distinct product_no from sales_order_details;

PRODUC                                                                          
------                                                                          
P07965                                                                          
P07885                                                                          
P06734                                                                          
P07975                                                                          
P03453                                                                          
P00001                                                                          

6 rows selected.

SQL> 
SQL> --2. Find the customer name, address, city and pincode for the client who has placed order no “019001”
SQL> select client_no from sales_order where s_order_no='019001';

CLIENT_NO                                                                       
-------------------------                                                       
0001                                                                            

SQL> 
SQL> select name, address1, address2, city, pincode from client_master where client_no in (select client_no from sales_order where s_order_no='019001');

NAME                 ADDRESS1                                                   
-------------------- ------------------------------                             
ADDRESS2                       CITY               PINCODE                       
------------------------------ --------------- ----------                       
Ivan                                                                            
                               Bombay              400054                       
                                                                                

SQL> 
SQL> --3. Find the client names who have placed order before the month of may 96.
SQL> 
SQL> --Know this, if you insert date year with two digit year i.e. format RR as 15 then from 00 to 49 are assumed to be in the 21st centure. Hence, it will be stored as 2015. While RR values ranging from 50 to 99 are assumed to be in the 20th century (1950 through 1999).
SQL> 
SQL> --When I inserted I did not focus on this and hence my database contains year 2096 instead of 1996.
SQL> 
SQL> --Lets first fix that.
SQL> 
SQL> --For below, I don't know its 1996 or 2096, so I applied to_char with YYYY.
SQL> 
SQL> select s_order_no, client_no, s_order_date from sales_order;

S_ORDE CLIENT_NO                 S_ORDER_D                                      
------ ------------------------- ---------                                      
019001 0001                      12-JAN-96                                      
019002 0002                      25-JAN-96                                      
016865 0003                      18-FEB-96                                      
019003 0001                      03-APR-96                                      
046866 0004                      20-MAY-96                                      
010008 0005                      24-MAY-96                                      

6 rows selected.

SQL> 
SQL> select s_order_no, client_no, to_char(s_order_date,'DD-MON-YYYY') from sales_order;

S_ORDE CLIENT_NO                 TO_CHAR(S_ORDER_DATE                           
------ ------------------------- --------------------                           
019001 0001                      12-JAN-2096                                    
019002 0002                      25-JAN-2096                                    
016865 0003                      18-FEB-2096                                    
019003 0001                      03-APR-2096                                    
046866 0004                      20-MAY-2096                                    
010008 0005                      24-MAY-2096                                    

6 rows selected.

SQL> 
SQL> --Applied string functions by oracle to retrieve 19XX.
SQL> 
SQL> SELECT TO_CHAR(
  2  	 to_date( SUBSTR(TO_CHAR(s_order_date,'DD-MON-YYYY'),1,7)
  3  	 ||'19'
  4  	 ||SUBSTR(TO_CHAR(s_order_date,'DD-MON-YYYY'),10,2))
  5  	 ,'DD-MON-YYYY') FROM sales_order;

TO_CHAR(TO_DATE(SUBS                                                            
--------------------                                                            
12-JAN-1996                                                                     
25-JAN-1996                                                                     
18-FEB-1996                                                                     
03-APR-1996                                                                     
20-MAY-1996                                                                     
24-MAY-1996                                                                     

6 rows selected.

SQL> 
SQL> 
SQL> --Lets update using this intermediate result logic.
SQL> update sales_order
  2  set s_order_date=(to_date( SUBSTR(TO_CHAR(s_order_date,'DD-MON-YYYY'),1,7)
  3  	 ||'19'||SUBSTR(TO_CHAR(s_order_date,'DD-MON-YYYY'),10,2)));

6 rows updated.

SQL> 
SQL> 
SQL> select to_char(s_order_date,'DD-MON-YYYY') from sales_order;

TO_CHAR(S_ORDER_DATE                                                            
--------------------                                                            
12-JAN-1996                                                                     
25-JAN-1996                                                                     
18-FEB-1996                                                                     
03-APR-1996                                                                     
20-MAY-1996                                                                     
24-MAY-1996                                                                     

6 rows selected.

SQL> 
SQL> 
SQL> select client_no, to_char(s_order_date,'DD-MON-YYYY') from sales_order where s_order_date<to_date('01-MAY-1996','DD-MON-YYYY');

CLIENT_NO                 TO_CHAR(S_ORDER_DATE                                  
------------------------- --------------------                                  
0001                      12-JAN-1996                                           
0002                      25-JAN-1996                                           
0003                      18-FEB-1996                                           
0001                      03-APR-1996                                           

SQL> 
SQL> 
SQL> 
SQL> --4. Find out if product “1.44 Drive” is ordered by only client and print the client_no name to whom it was sold.
SQL> 
SQL> select count(*) from sales_order_details where product_no in (select product_no from product_master where description='1.44 Drive');

  COUNT(*)                                                                      
----------                                                                      
         1                                                                      

SQL> 
SQL> 
SQL> select cm.client_no, cm.name from client_master cm, sales_order so, sales_order_details sod where so.s_order_no=sod.s_order_no and cm.client_no=so.client_no and sod.product_no in (select product_no from product_master where description='1.44 Drive');

CLIENT NAME                                                                     
------ --------------------                                                     
0005   Ravi                                                                     

SQL> 
SQL> 
SQL> --5. find the names of client who have placed orders worth Rs.10000 or more.
SQL> 
SQL> select name from client_master where client_no in (select so.client_no from sales_order so, sales_order_details sod where so.s_order_no=sod.s_order_no group by so.client_no having sum(sod.qty_order*sod.product_rate)>=10000);

NAME                                                                            
--------------------                                                            
Ivan                                                                            
Basu                                                                            

SQL> 
SQL> 
SQL> 
SQL> 
SQL> 
SQL> --6. Select the orders placed by ‘Rahul Desai”
SQL> 
SQL> select so.s_order_no from sales_order so, client_master cm
  2  	 where so.client_no=cm.client_no
  3  	 and cm.name='Rahul Desai';

no rows selected

SQL> 
SQL> 
SQL> select so.s_order_no from sales_order so, client_master cm
  2  	 where so.client_no=cm.client_no
  3  	 and cm.name='Ivan';

S_ORDE                                                                          
------                                                                          
019001                                                                          
019003                                                                          

SQL> 
SQL> 
SQL> select s_order_no from sales_order where client_no=(select distinct client_no from client_master where name='Ivan')
  2  	 ;

S_ORDE                                                                          
------                                                                          
019001                                                                          
019003                                                                          

SQL> 
SQL> 
SQL> select s_order_no, client_no, 'Ivan' name from sales_order where client_no=(    select client_no from client_master where name='Ivan');

S_ORDE CLIENT_NO                 NAME                                           
------ ------------------------- ----                                           
019001 0001                      Ivan                                           
019003 0001                      Ivan                                           

SQL> 
SQL> 
SQL> 
SQL> --7. Select the names of persons who are in Mr. Pradeep’s department and who have also worked on an inventory control system.
SQL> 
SQL> 
SQL> 
SQL> 
SQL> 
SQL> --8. Select all the clients and the salesman in the city of Bombay.
SQL> 
SQL>   (select sal_name name, 'salesman' title from salesman_master where lower(city)='bombay')
  2  	 union
  3  	 (select name name, 'client' title from client_master where lower(city)='bombay' )
  4  	 order by title;

NAME                 TITLE                                                      
-------------------- --------                                                   
Basu                 client                                                     
Ivan                 client                                                     
Pramada              client                                                     
Ravi                 client                                                     
Rukmini              client                                                     
Ashish               salesman                                                   
Kiran                salesman                                                   
Manish               salesman                                                   
Ravi                 salesman                                                   

9 rows selected.

SQL> 
SQL> 
SQL> --union vs union all (* union all allows duplicate). Note in below Ravi is client as well as salesman both.
SQL> 
SQL>   select sal_name from salesman_master where lower(city)='bombay';

SAL_NAME                                                                        
--------------------                                                            
Kiran                                                                           
Manish                                                                          
Ravi                                                                            
Ashish                                                                          

SQL> 
SQL> 
SQL> select name from client_master where lower(city)='bombay';

NAME                                                                            
--------------------                                                            
Pramada                                                                         
Basu                                                                            
Ravi                                                                            
Rukmini                                                                         
Ivan                                                                            

SQL> 
SQL> 
SQL> select sm.sal_name from salesman_master sm
  2  where sm.salesman_no in ( select so.salesman_no from client_master cm, sales_order so, salesman_master sm where cm.client_no=so.client_no and sm.salesman_no=so.salesman_no and lower(sm.city)='bombay' and lower(cm.city)='bombay' group by so.salesman_no);

SAL_NAME                                                                        
--------------------                                                            
Ravi                                                                            
Kiran                                                                           
Ashish                                                                          

SQL> --Having is not required as sales_order will have entries for orders and we are discussing clients and salesmen involved in placing orders.)
SQL> 
SQL> --10. Select the product_no, description, qty_on-hand,cost_price of non_moving items in the product_master table.
SQL> 
SQL> select product_no, description, qty_on_hand, cost_price from product_master where product_no not in (select distinct product_no from sales_order_details);

PRODUCT_NO           DESCRIPTION          QTY_ON_HAND COST_PRICE                
-------------------- -------------------- ----------- ----------                
P07865               1.22floppies                 100        500                
P07868               Keyboards                     10       3050                
P08865               1.22 Drive                     2       1000                

SQL> 
SQL> spool off;
